{
  "$schema": "https://fluidsbench.org/schemas/v2/submission.schema.json",
  "schema_version": "2.0",
  "submission_id": "example-open-model-v1",
  "model": "Example Open Model",
  "model_type": "Graph neural network",
  "model_types": ["Graph neural network"],
  "training_regime": "from_scratch",
  "target_data_used": "official_train",
  "external_pretraining": false,
  "pretraining_data": [],
  "dataset": "Replace with dataset name",
  "dataset_id": "replace-with-dataset-id",
  "dataset_version": "replace-with-dataset-version",
  "split": "Replace with split name",
  "split_id": "replace_with_split_id",
  "case_set_id": "replace_with_case_set_id",
  "split_sha256": "aaaaaaaaaaaaaaaaaaaaaaaaaaaaaaaaaaaaaaaaaaaaaaaaaaaaaaaaaaaaaaaa",
  "parameter_count_millions": 12.5,
  "submitter_name": "Example Researcher",
  "institution": "Example University",
  "paper_url": "https://example.org/papers/example-open-model",
  "code_url": "https://github.com/example/example-open-model",
  "submitted_at": "2026-07-21",
  "evaluation": {
    "reference_version": "replace-with-reference-version",
    "code_revision": "0123456789abcdef0123456789abcdef01234567",
    "command": "python evaluate.py --dataset replace-with-dataset-id --split replace_with_split_id",
    "evidence_file": "evaluation-evidence.json",
    "evidence_sha256": "fd12c949d11d788ed5b0096cfc4c960bf3746fc547e68b822d2c20eccb963384"
  },
  "reproducibility": {
    "contract_version": "open-reproducibility-2.0",
    "access": "public",
    "public_test_data_use": "evaluation_only",
    "result_data_license_spdx": "CC-BY-4.0",
    "code": {
      "repository_url": "https://github.com/example/example-open-model",
      "commit": "0123456789abcdef0123456789abcdef01234567",
      "license_spdx": "Apache-2.0"
    },
    "model_artifact": {
      "url": "https://example.org/artifacts/example-open-model-v1.tar.zst",
      "sha256": "bbbbbbbbbbbbbbbbbbbbbbbbbbbbbbbbbbbbbbbbbbbbbbbbbbbbbbbbbbbbbbbb",
      "license_spdx": "Apache-2.0"
    },
    "environment": {
      "kind": "lockfile",
      "url": "https://example.org/artifacts/example-open-model-v1.lock",
      "sha256": "cccccccccccccccccccccccccccccccccccccccccccccccccccccccccccccccc"
    },
    "artifact_documentation_url": "https://github.com/example/example-open-model/blob/0123456789abcdef0123456789abcdef01234567/ARTIFACTS.md"
  },
  "metric_values": {
    "replace_with_metric_id": 0.125
  },
  "profile_data": {
    "format": "fluidsbench-profile-chunks-v1",
    "index_file": "profiles/index.json",
    "case_count": 1,
    "case_set_id": "replace_with_case_set_id",
    "profile_ground_truth_release_id": "prototype-profile-ground-truth-2026-08-21",
    "profile_ground_truth_manifest_sha256": "8a88dd6fc64914603a0f8f4c498a3b0ec1d349d24e8f24a2a606494221c4bd25"
  },
  "note": "Schema-valid template only. Replace every placeholder with values from an official benchmark specification."
}
